<?xml version="1.0" encoding="UTF-8"?>
<!--~~~~~~~~~~~~~~~~~~~~~~~~~~~~~~~~~~~~~~~~~~~~~~~~~~~~~~~~~~~~~~
  ~   Licensed to the Apache Software Foundation (ASF) under one
  ~  or more contributor license agreements.  See the NOTICE file
  ~  distributed with this work for additional information
  ~  regarding copyright ownership.  The ASF licenses this file
  ~  to you under the Apache License, Version 2.0 (the
  ~  "License"); you may not use this file except in compliance
  ~  with the License.  You may obtain a copy of the License at
  ~
  ~    https://www.apache.org/licenses/LICENSE-2.0
  ~
  ~  Unless required by applicable law or agreed to in writing,
  ~  software distributed under the License is distributed on an
  ~  "AS IS" BASIS, WITHOUT WARRANTIES OR CONDITIONS OF ANY
  ~  KIND, either express or implied.  See the License for the
  ~  specific language governing permissions and limitations
  ~  under the License.
  ~~~~~~~~~~~~~~~~~~~~~~~~~~~~~~~~~~~~~~~~~~~~~~~~~~~~~~~~~~~~~-->

<xs:schema targetNamespace="http://cayenne.apache.org/schema/14/project"
           elementFormDefault="qualified" version="14"
           xmlns:xs="http://www.w3.org/2001/XMLSchema"
           xmlns:cay="http://cayenne.apache.org/schema/14/project">

    <xs:element name="project">
        <xs:complexType>
            <xs:sequence>
                <xs:element minOccurs="0" maxOccurs="unbounded" ref="cay:map"/>
                <xs:any minOccurs="0" maxOccurs="unbounded" namespace="##other" processContents="lax"/>
            </xs:sequence>
            <xs:attribute name="sharedCache" type="xs:boolean" default="true">
                <xs:annotation>
                    <xs:documentation>Defines whether the object snapshots are cached in a cache shared between all ObjectContexts.</xs:documentation>
                </xs:annotation>
            </xs:attribute>
            <xs:attribute name="validateOnCommit" type="xs:boolean" default="true">
                <xs:annotation>
                    <xs:documentation>Defines whether the objects are validated before they are committed.</xs:documentation>
                </xs:annotation>
            </xs:attribute>
        </xs:complexType>
    </xs:element>

    <xs:element name="map">
        <xs:annotation>
            <xs:documentation>Link to an external file with data map.</xs:documentation>
        </xs:annotation>
        <xs:complexType>
            <xs:attribute name="name" use="required" type="xs:string"/>
        </xs:complexType>
    </xs:element>

</xs:schema>
