<?xml version="1.0" encoding="utf-8"?>
<project xmlns="http://cayenne.apache.org/schema/15/project"
	 xmlns:xsi="http://www.w3.org/2001/XMLSchema-instance"
	 xsi:schemaLocation="http://cayenne.apache.org/schema/15/project https://cayenne.apache.org/schema/15/project.xsd">
	<map name="testmap"/>
	<map name="compound"/>
	<map name="misc-types"/>
	<map name="things"/>
	<map name="numeric-types"/>
	<map name="binary-pk"/>
	<map name="no-pk"/>
	<map name="lob"/>
	<map name="date-time"/>
	<map name="enum"/>
	<map name="json"/>
	<map name="extended-type"/>
	<map name="generated"/>
	<map name="mixed-persistence-strategy"/>
	<map name="people"/>
	<map name="primitive"/>
	<map name="inheritance"/>
	<map name="locking"/>
	<map name="soft-delete"/>
	<map name="empty"/>
	<map name="relationships"/>
	<map name="relationships-activity"/>
	<map name="relationships-delete-rules"/>
	<map name="relationships-collection-to-many"/>
	<map name="relationships-child-master"/>
	<map name="relationships-clob"/>
	<map name="relationships-flattened"/>
	<map name="relationships-many-to-many-join"/>
	<map name="relationships-set-to-many"/>
	<map name="relationships-to-many-fk"/>
	<map name="relationships-to-one-fk"/>
	<map name="return-types"/>
	<map name="uuid"/>
	<map name="multi-tier"/>
	<map name="reflexive"/>
	<map name="lifecycle-callbacks-order"/>
	<map name="map-to-many"/>
	<map name="meaningful-pk"/>
	<map name="table-primitives"/>
	<map name="generic"/>
	<map name="map-db1"/>
	<map name="map-db2"/>
	<map name="embeddable"/>
	<map name="qualified"/>
	<map name="quoted-identifiers"/>
	<map name="inheritance-single-table1"/>
	<map name="inheritance-vertical"/>
	<map name="oneway-rels"/>
	<map name="unsupported-distinct-types"/>
	<map name="array-type"/>
	<map name="cay-2032"/>
	<map name="weighted-sort"/>
	<map name="hybrid-data-object"/>
	<map name="legacy-date-time"/>
	<map name="inheritance-with-enum"/>
	<map name="lazy-attributes"/>
	<map name="cay2666/datamap"/>
	<map name="cay2641/datamapLazy"/>
	<map name="entity_callbacks/datamapEntityCallbacks"/>
</project>
